address,area,city,hotel_description,hotel_facilities,hotel_star_rating,image_urls,latitude,longitude,property_name,property_type,room_area,room_count,room_facilities,room_type,state,tad_review_count,tad_review_rating,tad_stay_review_rating,room_price,occupancy,additional_info
"Betathur, Bhagamandala Hobli, Madikeri Taluk",Madikeri,Coorg,"Three Hills, Coorg, is nestled amidst ever-lasting greenery to offer a peaceful getaway to city dwellers. This property has the best of services to ensure a comforting stay to the vacationers. Each room is enclosed with wooden walls and features prominent facilities. Guests are served with delightful hospitality and a memorable accommodation experience. With a picturesque panorama around, one gets the chance to immerse in natures abundance.LocationThis hotel stands tall in Madikeri Taluk and lies in closest linking to destinations like Abbi Falls 29km (approx.), Nisargadhama Forest 20km (approx.), Dubare Elephant Camp 50km (approx.), Raja's Seat 23km (approx.), Talacauvery 23km (approx.), Omkareshwara Temple 25km (approx.) and Namdroling Monastery 57km (approx.).Mangalore Airport- 161km (approx.)Mangalore Central Railway Station- 151km (approx.)FacilitiesPower back-up, parking and outdoor activities are major facilities offered by this property. This hotel is supported with continuous power back-up to ensure comfort and convenience to the patrons. There is ample space in the parking lot to accommodate safe placement of vehicles. Vacationers can enjoy a range of outdoor activities like bird watching, cycling, and wildlife safari.Rooms Three Hills has few neatly appointed rooms in two categories- Superior villa guest room and Deluxe cottage to offer for lodging. Each room is highly snug in ambiance and is decked up with polished wooden furnishing. Guests get access to services like tea/coffee maker, in-room safe, TV and attached bathroom. Every bathroom is well equipped and has continuous supply of hot and cold water.",Travel:Parking|Free Parking|Personal Services:Room Service|Recreation:Indoor Games|Basics:Housekeeping,1 Star hotel,http://ui.cltpstatic.com/places/hotels/7393/739322/images/50_w.jpg|http://ui.cltpstatic.com/places/hotels/7393/739322/images/49_w.jpg|http://ui.cltpstatic.com/places/hotels/7393/739322/images/51_w.jpg|http://ui.cltpstatic.com/places/hotels/7393/739322/images/52_w.jpg|http://ui.cltpstatic.com/places/hotels/7393/739322/images/54_w.jpg|http://ui.cltpstatic.com/places/hotels/7393/739322/images/58_w.jpg|http://ui.cltpstatic.com/places/hotels/7393/739322/images/65_w.jpg|http://ui.cltpstatic.com/places/hotels/7393/739322/images/66_w.jpg|http://ui.cltpstatic.com/places/hotels/7393/739322/images/70_w.jpg|http://ui.cltpstatic.com/places/hotels/7393/739322/images/78_w.jpg|http://ui.cltpstatic.com/places/hotels/7393/739322/images/10_w.jpg|http://ui.cltpstatic.com/places/hotels/7393/739322/images/21_w.jpg|http://ui.cltpstatic.com/places/hotels/7393/739322/images/60_w.jpg|http://ui.cltpstatic.com/places/hotels/7393/739322/images/16_w.jpg,12.398337699999999,75.6405501,Leisure Vacations Three Hills Resort,Service Apartment,15 X 15 Sq.ft.,4,Television | Satellite Television | Wooden Floor | Private Bathroom | Luggage Rack,Deluxe Villa,Karnataka,46.0,4.5,Location::4.5|Rooms::4.5|Service::4.5|Value::4.5|Cleanliness::4.5|Sleep Quality::4.5,6864per night incl. tax,1 Adult 2 Kids,Room Service|Internet Access|Restaurant
"Kannika International, 4-12(3), I.B. Road, Kushalnagar",Kushalnagar,Coorg,"One can have a joyous stay at Kannika International, thanks to its simple rooms, essential amenities and homely ambience. Additionally, one can savour tempting meals at the in-house restaurant.",Food &amp; Beverage:Bar|Restaurant|Coffee Shop|Travel:Travel Desk|Parking|Transportation Service|Personal Services:24 Hour Front Desk|Laundry|Room Service|Hotel Amenities:24-Hour Security|Business Services:Conference Hall|Basics:Doorman|Housekeeping|Doctor on Call|No Category:Front Desk|Phone Service,2 Star hotel,http://ui.cltpstatic.com/places/hotels/1592/159299/images/k_w.jpg|http://ui.cltpstatic.com/places/hotels/1592/159299/images/7-29-2013_6-17-13_PM_w.jpg|http://ui.cltpstatic.com/places/hotels/1592/159299/images/7-29-2013_6-21-11_PM_w.jpg|http://ui.cltpstatic.com/places/hotels/1592/159299/images/7-29-2013_6-22-08_PM_w.jpg|http://ui.cltpstatic.com/places/hotels/1592/159299/images/7-29-2013_6-22-29_PM_w.jpg|http://ui.cltpstatic.com/places/hotels/1592/159299/images/7-29-2013_6-21-42_PM_w.jpg|http://ui.cltpstatic.com/places/hotels/1592/159299/images/7-29-2013_6-22-51_PM_w.jpg|http://ui.cltpstatic.com/places/hotels/1592/159299/images/7-29-2013_6-23-19_PM_w.jpg|http://ui.cltpstatic.com/places/hotels/1592/159299/images/7-29-2013_6-23-40_PM_w.jpg|http://ui.cltpstatic.com/places/hotels/1592/159299/images/Room 1_w.jpg|http://ui.cltpstatic.com/places/hotels/1592/159299/images/Restaurant & Bar_w.jpg,12.4580521,75.95991049999999,Kannika International,Hotel,15 X 15 Sq.ft.,16,Air Conditioning| Television| Iron| Safe| Telephone | Hot Water | Newspaper Intercom Hangers In-Room Menu Laundry Bag | Satellite Television | Private Bathroom | Luggage Rack,Deluxe Room,Karnataka,15.0,3.0,Location::4.0|Rooms::2.5|Service::3.0|Value::3.5|Cleanliness::2.5|Sleep Quality::3.0,400per night incl. tax,1 Adult 1 Kid,Room Service|Internet Access|Restaurant
"Saatvik Home Stays Kushalnagar, Kudige Road",Kushalnagar,Coorg,A peaceful resting place situated around beautiful landscapes of Coorg. Calm ambiance of the hotel makes your stay memorable.,Travel:Parking|Outdoor Parking|Basics:24 Hour Power Supply,1 Star hotel,http://ui.cltpstatic.com/places/hotels/1332/1332942/images/IMG-20151130-WA0008_w.jpg|http://ui.cltpstatic.com/places/hotels/1332/1332942/images/IMG-20151130-WA0007_w.jpg|http://ui.cltpstatic.com/places/hotels/1332/1332942/images/IMG-20151130-WA0012_w.jpg|http://ui.cltpstatic.com/places/hotels/1332/1332942/images/IMG-20151130-WA0013_w.jpg|http://ui.cltpstatic.com/places/hotels/1332/1332942/images/IMG-20151130-WA0014_w.jpg|http://ui.cltpstatic.com/places/hotels/1332/1332942/images/IMG-20151130-WA0017_w.jpg|http://ui.cltpstatic.com/places/hotels/1332/1332942/images/IMG-20151130-WA0018_w.jpg|http://ui.cltpstatic.com/places/hotels/1332/1332942/images/IMG-20151130-WA0007_w.jpg|http://ui.cltpstatic.com/places/hotels/1332/1332942/images/IMG-20151130-WA0010_w.jpg|http://ui.cltpstatic.com/places/hotels/1332/1332942/images/IMG-20151130-WA0002_w.jpg|http://ui.cltpstatic.com/places/hotels/1332/1332942/images/IMG-20151130-WA0003_w.jpg|http://ui.cltpstatic.com/places/hotels/1332/1332942/images/IMG-20151130-WA0005_w.jpg|http://ui.cltpstatic.com/places/hotels/1332/1332942/images/IMG-20151130-WA0006_w.jpg,12.49808,75.936041,Saatvik Home Stays,Hotel,12 X 13 Sq.ft.,5,Television| Telephone| Spare Mattress | Hot Water | Toiletries Mirror Marble Floor | Satellite Television | Private Bathroom,Deluxe Room,Karnataka,,,,473per night incl. tax,2 Adults 2 Kids,Room Service|Gym/Spa|Swimming Pool|Restaurant
"Kodava Samaja Complex, Main Road, Madikeri",Madikeri,Coorg,"Situated in the heart of Coorg, The Fort Mercara is a perfect destination for every leisure guest. The well-maintained rooms, basic amenities and a heart-warming hospitality of the hotel accentuate the guests' overall staying experience.",Food &amp; Beverage:Restaurant|Personal Services:24 Hour Front Desk|Room Service|Travel:Parking|Free Parking|Hotel Amenities:24-Hour Security|Basics:Doorman|Housekeeping|No Category:Front Desk,2 Star hotel,http://ui.cltpstatic.com/places/hotels/7137/713774/images/1_w.jpg|http://ui.cltpstatic.com/places/hotels/7137/713774/images/dsfgd_w.jpg|http://ui.cltpstatic.com/places/hotels/7137/713774/images/5_w.jpg|http://ui.cltpstatic.com/places/hotels/7137/713774/images/6_w.jpg|http://ui.cltpstatic.com/places/hotels/7137/713774/images/11_w.jpg|http://ui.cltpstatic.com/places/hotels/7137/713774/images/12_w.jpg|http://ui.cltpstatic.com/places/hotels/7137/713774/images/13_w.jpg|http://ui.cltpstatic.com/places/hotels/7137/713774/images/sdfdf_w.jpg|http://ui.cltpstatic.com/places/hotels/7137/713774/images/Executive_w.jpg|http://ui.cltpstatic.com/places/hotels/7137/713774/images/2_w.jpg|http://ui.cltpstatic.com/places/hotels/7137/713774/images/3_w.jpg,12.420544,75.74034499999999,The Fort Mercara,Hotel,17 X 17 Sq.ft.,11,Telephone | Television | Flat Screen Television | Hangers | Private Bathroom | Writing Desk / Study Table,Deluxe Non AC,Karnataka,61.0,4.0,Location::4.0|Rooms::4.0|Service::4.0|Value::3.5|Cleanliness::4.0|Sleep Quality::4.0,500per night incl. tax,2 Adults 2 Kids,Room Service|Internet Access|Gym/Spa|Swimming Pool|Restaurant
Thalathmane Village Post Madikeri,Madikeri,Coorg,"OYO Premium Brook Stone Villas Madikeri is located amidst the lush greenery in Coorg. Facilitated with desirable amenities, it is ideal for those who need to take a break from crowded cities and reconnect with nature.",Basics:Internet|Doorman|Housekeeping|Complimentary Wi-Fi access|24 Hour Power Supply|Food &amp; Beverage:Restaurant|Personal Services:24 Hour Front Desk|Room Service|Travel:Parking|Hotel Amenities:24-Hour Security,3 Star hotel,http://ui.cltpstatic.com/places/hotels/1350/1350242/images/rv_w.jpg|http://ui.cltpstatic.com/places/hotels/1350/1350242/images/room_w.jpg|http://ui.cltpstatic.com/places/hotels/1350/1350242/images/room1_w.jpg|http://ui.cltpstatic.com/places/hotels/1350/1350242/images/room2_w.jpg|http://ui.cltpstatic.com/places/hotels/1350/1350242/images/room3_w.jpg|http://ui.cltpstatic.com/places/hotels/1350/1350242/images/room4_w.jpg|http://ui.cltpstatic.com/places/hotels/1350/1350242/images/bathroom_w.jpg|http://ui.cltpstatic.com/places/hotels/1350/1350242/images/bathroom1_w.jpg|http://ui.cltpstatic.com/places/hotels/1350/1350242/images/bathroom2_w.jpg|http://ui.cltpstatic.com/places/hotels/1350/1350242/images/rest_w.jpg,12.42383,75.70128000000001,OYO Premium Brook Stone Villas Madikeri Coorg,Hotel,15 X 15 Sq.ft.,15,Television,Premium Room,Karnataka,,,,500per night incl. tax,2 Adults 2 Kids,Room Service|Restaurant
"Opp.Bharath Matha School, B.M Road, Kushalnagar",Kushalnagar,Coorg,Ashraya residency is ideally located near Kushalnagar where one has easy access to all the tourist spots.,Food &amp; Beverage:Restaurant|Personal Services:Room Service|Basics:Express Check-In|Express Check-Out|24 Hour Power Supply,1 Star hotel,http://ui.cltpstatic.com/places/hotels/1344/1344086/images/9_w.jpg|http://ui.cltpstatic.com/places/hotels/1344/1344086/images/3_w.jpg|http://ui.cltpstatic.com/places/hotels/1344/1344086/images/10_w.jpg|http://ui.cltpstatic.com/places/hotels/1344/1344086/images/room4_w.jpg,12.445762,75.98048100000001,Ashiyana Residency,Hotel,10 X 10 Sq.ft.,10,Television| Spare Mattress | Hot Water | Ceiling Fan | Marble Floor | Private Bathroom,Double Room,Karnataka,,,,1569per night incl. tax,2 Adults 2 Kids,Room Service|Restaurant|Free Internet
"Nangala Village,Bittangala Post,Virajpe",Virajpet,Coorg,"Evergreen County Was started this journey with an idea to share a space with the people who like to explore the real beauty of nature and the culture of COORG. Coorg Evergreen County operates with a blend of different themes like Nature, Adventure, Classical, Traditional, Man v/s Wild etc..We have tried our best to keep the County away from any kind of mechanical disturbances and luxuries.With a personnel attention and interest we are happy to host people coming to Coorg Evergreen County to feel the difference and return with an everlasting relationship after a memorable stay.",Travel:Parking|Free Parking|Outdoor Parking|Personal Services:Room Service|Basics:Housekeeping,2 Star hotel,http://ui.cltpstatic.com/places/hotels/7183/718356/images/ever_res_w.jpg|http://ui.cltpstatic.com/places/hotels/7183/718356/images/dfds_w.jpg|http://ui.cltpstatic.com/places/hotels/7183/718356/images/gtfdg_w.jpg|http://ui.cltpstatic.com/places/hotels/7183/718356/images/ever_bamboo_w.jpg|http://ui.cltpstatic.com/places/hotels/7183/718356/images/erer_w.jpg|http://ui.cltpstatic.com/places/hotels/7183/718356/images/ftyrd_w.jpg|http://ui.cltpstatic.com/places/hotels/7183/718356/images/tyuy_w.jpg|http://ui.cltpstatic.com/places/hotels/7183/718356/images/uyu_w.jpg|http://ui.cltpstatic.com/places/hotels/7183/718356/images/hgjh_w.jpg|http://ui.cltpstatic.com/places/hotels/7183/718356/images/jhkjh_w.jpg,12.149305,75.834127,Evergreen County,Resort,15 X 15 Sq.ft.,6,Private Bathroom | Luggage Rack,Bamboo Hut,Karnataka,236.0,4.5,Location::4.5|Rooms::4.5|Service::4.5|Value::4.5|Cleanliness::4.5|Sleep Quality::4.5,2323per night incl. tax,2 Adults 2 Kids,Room Service|Internet Access
"Mangala Devi Nagar, Madikeri",Madikeri,Coorg,"Hotel Hill Valley, Coorg is a modish hotel that lures the guests with its sheer beauty and magnificent décor. The entire property is surrounded by expansive landscapes and greenery. The in-house restaurant serving mouth watering cuisine is an ideal place to unwind and spend evenings with family.Location: Hotel Hill Valley is located at Mangala Devi Nagar, Madikeri. Omkareshwara temple Madikeri (Approx. 1km) and the Abbi Falls (Approx. 7km) are some of the places to visit from the hotel. Abbi Falls is located around 8 km away from the town of Madikeri, in the mountains of the Western Ghats. Nestled between a private coffee plantations and spice estates, this waterfall descends into the Cauvery River. Other places that guests can visit are the Brahmagiri Wildlife Sanctuary, Chomamale Hill and the Valnur Fishing Camp.Distance from Mangalore Airport: Approx. 140kmsDistance from Mysore Junction Railway Station: Approx.116kmsHotel Features: The hotel offers great accommodation and a host of other activities to entertain guests. The basic amenities of the hotel include room service, 24-hour front desk, baby sitting, front desk, security and doctor-on- call. The hotel also arranges fishing, trekking, transport and sightseeing facilities on request. The in- house dining facility serves authentic vegetarian and non- vegetarian cuisine which guests can indulge in during the stay. Rooms: Standard room is the only option offered to the guests for accommodation is well- appointed, cosy and spacious. The breath-taking scenic views of greenery ensures a pleasant stay for the guests. Colour television and Satellite TV are provided as basic amenities in the rooms.",Travel:Travel Desk|Parking|Free Parking|Transportation Service|Personal Services:24 Hour Front Desk|Babysitting|Laundry|Room Service|Hotel Amenities:24-Hour Security|Basics:Doorman|Housekeeping|Complimentary Wi-Fi access|Wi-Fi on Charge|Doctor on Call|No Category:Front Desk|Phone Service,3 Star hotel,http://ui.cltpstatic.com/places/hotels/7084/708467/images/09_w.jpg|http://ui.cltpstatic.com/places/hotels/7084/708467/images/01_w.jpg|http://ui.cltpstatic.com/places/hotels/7084/708467/images/02_w.jpg|http://ui.cltpstatic.com/places/hotels/7084/708467/images/03_w.jpg|http://ui.cltpstatic.com/places/hotels/7084/708467/images/04_w.jpg|http://ui.cltpstatic.com/places/hotels/7084/708467/images/05_w.jpg|http://ui.cltpstatic.com/places/hotels/7084/708467/images/06_w.jpg|http://ui.cltpstatic.com/places/hotels/7084/708467/images/10_w.jpg|http://ui.cltpstatic.com/places/hotels/7084/708467/images/12_w.jpg|http://ui.cltpstatic.com/places/hotels/7084/708467/images/07_w.jpg|http://ui.cltpstatic.com/places/hotels/7084/708467/images/08_w.jpg|http://ui.cltpstatic.com/places/hotels/7084/708467/images/7-29-2013_5-54-53_PM_w.jpg|http://ui.cltpstatic.com/places/hotels/7084/708467/images/9_w.jpg|http://ui.cltpstatic.com/places/hotels/7084/708467/images/11_w.jpg|http://ui.cltpstatic.com/places/hotels/7084/708467/images/14_w.jpg|http://ui.cltpstatic.com/places/hotels/7084/708467/images/22_w.jpg|http://ui.cltpstatic.com/places/hotels/7084/708467/images/24_w.jpg|http://ui.cltpstatic.com/places/hotels/7084/708467/images/13_w.jpg|http://ui.cltpstatic.com/places/hotels/7084/708467/images/26_w.jpg,12.414634,75.74716240000001,Hill Valley Coorg,Hotel,15 X 15 Sq.ft.,7,Television | Newspaper Flat Screen Television Hangers | Satellite Television | Private Bathroom | Luggage Rack,Standard Room,Karnataka,6.0,3.0,Location::4.0|Rooms::3.5|Service::4.0|Value::3.5|Cleanliness::4.0|Sleep Quality::3.0,723per night incl. tax,1 Adult 1 Kid,Room Service|Internet Access|Restaurant
"Billur Post, Pattadur Village, Mudigere Taluk,",Mudigere,Chikmaglur,"At Flameback Lodges, Chikmagalur, travellers can experience a treasure trove of natural beauty, meticulously designed accommodations, multifarious facilities for leisure and also scrumptious delicacies. In addition, the serenity of the surrounding, solitude and the warm hospitality add to its worth.Location:Flameback Lodges is placed at Billur Post, Pattadur Village, Mudigere Taluk. Travellers must plan a trip to Hanumana Gundi Falls, Guru Dattatreya Bababudanswamy Darga and Hebbe Falls also. The captivating Hanumana Gundi Falls cascades on to the natural rock formations from a great height.Distance from HAL Bangalore International Airport: 300 km (approx.)Distance from Chikmaglur Railway Station: 32 km (approx.) Hotel Features:Guests can rejuvenate, relax and indulge in culinary delights at this resting place. Room service, internet, 24-hour front desk, 24-hour security, parking and doctor-on-call include the basic services. Guests can pamper themselves with the body treatments, steam bath, Jacuzzi and massage services available at this homestay. They can also enjoy regular fitness sessions at the Gym and a refreshing dip at the Pool. At the in-house restaurant and bar, patrons can relish an amazing dining experience with mouth-watering buffet and beverages in a scenic setting.Rooms:Luxury Villas and Paddy cottages provided at Flameback Lodges. These rooms are fully air conditioned and tastefully decorated with wooden furniture. The tranquil ambience inside is well-balanced with the lovely panoramic scenery outside these rooms. They include various in-room amenities for convenience such as colour TV with multiple channels, tea/coffee maker, refrigerator, writing desk and International plug points.",Food &amp; Beverage:Bar|Restaurant|Basics:Internet|Doorman|Housekeeping|Doctor on Call|Recreation:Kids Pool|Gym|Indoor Games|Jacuzzi|Massage Centre|Outdoor Swimming Pool|Steam Bath|Personal Services:24 Hour Front Desk|Laundry|Room Service|Dry Cleaning|Hotel Amenities:24-Hour Security|No Category:Body Treatments|Free Newspaper|Front Desk|Travel:Free Parking|Outdoor Parking|Porter|Transportation Service|Valet Parking|Basic Room Amenities:Wake-Up Call Service,2 Star hotel,http://ui.cltpstatic.com/places/hotels/3792/379267/images/7-20-2012_3-21-43_PM_w.jpg|http://ui.cltpstatic.com/places/hotels/3792/379267/images/contact_i1mg_w.jpg|http://ui.cltpstatic.com/places/hotels/3792/379267/images/Untitled_w.jpg|http://ui.cltpstatic.com/places/hotels/3792/379267/images/7-20-2012_3-36-58_PM_w.jpg|http://ui.cltpstatic.com/places/hotels/3792/379267/images/7-20-2012_3-18-38_PM_w.jpg|http://ui.cltpstatic.com/places/hotels/3792/379267/images/7-20-2012_3-19-34_PM_w.jpg|http://ui.cltpstatic.com/places/hotels/3792/379267/images/7-20-2012_3-19-41_PM_w.jpg|http://ui.cltpstatic.com/places/hotels/3792/379267/images/7-20-2012_3-22-00_PM_w.jpg|http://ui.cltpstatic.com/places/hotels/3792/379267/images/7-20-2012_3-21-27_PM_w.jpg|http://ui.cltpstatic.com/places/hotels/3792/379267/images/7-20-2012_3-20-55_PM_w.jpg,13.142756,75.63022,"Flameback, Mudigere (30 km from Chikmaglur)",Guest House,14 X 14 Sq.ft.,8,Air Conditioning| Pets Allowed | Room Heater | Hair Dryer Newspaper Refrigerator Bathtub Bedside Lamp Ceiling Fan Mineral Water Toiletries Flat Screen Television Jacuzzi Laundry Bag Satellite Television Tea / Coffee maker Turn Down Service Windows Open Wooden Floor | International Plug Point | Private Bathroom Balcony / Sit Out Area Luggage Rack | Writing Desk / Study Table,Luxury Villa,Karnataka,92.0,4.5,Location::4.5|Rooms::5.0|Service::4.5|Value::4.5|Cleanliness::4.5|Sleep Quality::4.5,1156per night incl. tax,1 Adult 1 Kid,Room Service|Free Internet
"Ashervad Kalpavriksha, Nettigeri Estate,Kumboor village & Post, Via Madapura,North Kodagu,Coorg",Virajpet,Coorg,"Hotel Ashirwad Estate Stay, Coorg is surrounded by greenery with breathtaking scenic waterfalls. Ideal place for a quiet vacation where guests can take leisure evening strolls without the pollution or congestion of traffic noise. In spite of it being located in quiet surroundings, the bungalow is in proximity to restaurants and surrounded by estates.Location: Hotel Ashirwad Estate Stay is located at Ashervad Kalpavriksha, Nettigeri Estate, Madapura. Gadinand Forest (Approx. 8km) and Hattihole Church (Approx. 9km) are some nearby places worth visiting. Guests can take a day's tour to Gaddige, Madikeri Fort and Mallalli Falls. Coorg also known as Kodagu is a beautiful hill station full of amazing scenery and is located in the region covered by the Western Ghats.Distance from Bangalore International Airport: Approx. 317kmsDistance from Mysore Railway Station: Approx. 137kmsHotel Features: Hotel Ashirwad Estate Stay provides a gracious blend of warm hospitality and quality furnishing at independent bungalows that are fully equipped and well maintained for a comfortable home stay. The basic amenities offered to the guests are room service, indoor/outdoor parking, travel desk, security and doctor-on-call. Additionally on request, the hotel arranges for outdoor activities like trekking and estate visit. Apart from normal breakfast, the in-house dining facility provides delicious traditional vegetarian and non-vegetarian dishes for lunch and dinner.Rooms: Hotel Ashirwad Estate Stay offers standard rooms for accommodation. The rooms are spacious and well planned with basic amenities, including colour television, telephone and in-room menu. The bungalows have a separate living area, dining area and a well-stocked kitchen where guests have the option of cooking home meals.",Travel:Travel Desk|Parking|Indoor Parking|Personal Services:Laundry|Room Service|Hotel Amenities:24-Hour Security|Basics:Doorman|Housekeeping|Doctor on Call|No Category:Front Desk|Phone Service,1 Star hotel,http://ui.cltpstatic.com/places/hotels/3798/379812/images/kal_w.gif|http://ui.cltpstatic.com/places/hotels/3798/379812/images/DSC01448_w.gif|http://ui.cltpstatic.com/places/hotels/3798/379812/images/DSC01443_w.gif|http://ui.cltpstatic.com/places/hotels/3798/379812/images/DSC01459_w.gif|http://ui.cltpstatic.com/places/hotels/3798/379812/images/DSC01447_w.gif,12.523249,75.83071,Ashirwad Estate Stay,Hotel,15 X 15 Sq.ft.,2,Luggage Rack | Private Bathroom | Marble Floor Hangers Windows Open | In-Room Menu | Television | Telephone,Standard,Karnataka,,,,1250per night incl. tax,2 Adults 2 Kids,Room Service
"I.G.Road,",IG Road,Chikmaglur,"Hotel Rajmahal, Chikmaglur, is an elegant place with traditional Indian hospitality and interiors with modern and graceful architecture. Set in the heart of coffee hills, the hotel is very well suited to business and leisure travellers. Giving attention to every detail, it makes sure the guests are satisfied and enjoy their stay immensely.Location: The hotel is located at I.G. road. Chikmaglur is blessed with a rich diversity of agricultural products, which is reflected in the state's delightful cuisine. The places to visit are Sringeri, Guru Dattatreya Bababudanswamy Darga and Bhadra Wildlife Sanctuary. The wildlife sanctuary and project tiger reserve occupies a large area and the forests are filled with rich bamboo, beautiful species of unique birds.Distance from HAL Bangalore International Airport: 265 km (approx.)Distance from Chikmaglur Railway Station: 3 km (approx.)Hotel Features: Hotel Rajmahal provides all the necessary amenities and facilities to make guests feel at home and help make their stay pleasurable and relaxing. The basic amenities offered include room service, front desk, parking facilities, doctor-on-call and 24-hour security. The perfect place to stay, it also has an in-house restaurant and bar with a cosy and soft ambience.Rooms: The accommodations offered at the hotel varies to suit every travellers need. They comprise of standard double room with or without air conditioner, deluxe double room with or without air conditioner and deluxe four bedded and three bedded rooms. Flat screen television, telephone and writing table are some of the basic room amenities provided by the hotel. The rooms are well maintained and comfortable for a good night's rest and relaxation.",Food &amp; Beverage:Bar|Restaurant|Personal Services:24 Hour Front Desk|24 Hour Room Service|Laundry|Room Service|Dry Cleaning|Travel:Parking|Free Parking|Hotel Amenities:24-Hour Security|Basics:Doorman|Express Check-Out|Housekeeping|Doctor on Call|No Category:Front Desk,2 Star hotel,http://ui.cltpstatic.com/places/hotels/3352/335260/images/802_w.jpg|http://ui.cltpstatic.com/places/hotels/3352/335260/images/1_w.jpg|http://ui.cltpstatic.com/places/hotels/3352/335260/images/74_w.jpg|http://ui.cltpstatic.com/places/hotels/3352/335260/images/19_w.jpg|http://ui.cltpstatic.com/places/hotels/3352/335260/images/ftfy_w.jpg|http://ui.cltpstatic.com/places/hotels/3352/335260/images/33_w.jpg|http://ui.cltpstatic.com/places/hotels/3352/335260/images/14_w.jpg|http://ui.cltpstatic.com/places/hotels/3352/335260/images/27_w.jpg|http://ui.cltpstatic.com/places/hotels/3352/335260/images/87_w.jpg|http://ui.cltpstatic.com/places/hotels/3352/335260/images/hhh_w.jpg|http://ui.cltpstatic.com/places/hotels/3352/335260/images/828_copy_w.jpg,13.321079000000001,75.771959,Hotel Rajmahal,Hotel,15 X 15 Sq.ft.,50,Television | Telephone | Bedside Lamp Express Laundry Service Mirror Hangers Laundry Bag | Windows Open | Luggage Rack,Standard Double Room,Karnataka,56.0,3.0,Location::4.0|Rooms::3.0|Service::3.5|Value::3.5|Cleanliness::3.0|Sleep Quality::3.0,1067per night incl. tax,2 Adults 2 Kids,Room Service|Internet Access|Restaurant
