address,area,city,hotel_description,hotel_facilities,hotel_star_rating,image_urls,latitude,longitude,property_name,property_type,room_area,room_count,room_facilities,room_type,state,tad_review_count,tad_review_rating,tad_stay_review_rating,room_price,occupancy,additional_info
"Tantipala Road, Makkandur, Madikeri",Madikeri,Coorg,"The rooms are designed on a floral theme, which is echoed in the bathrooms and the furnishings as well. All rooms offer a kaleidoscope view of the hills, covered with lush green forest and a scenic view of the sunset, which is phenomenal.",Basics:Internet|Non-Smoking Rooms|Complimentary Wi-Fi access|Food &amp; Beverage:Restaurant|Personal Services:24 Hour Front Desk|Room Service|Travel:Parking|Transportation Service|Business Services:Fax|Recreation:Bonfire Arrangement,3 Star hotel,http://ui.cltpstatic.com/places/hotels/8662/866248/images/Leisure_Vacations_Copperhill_Villa_(4)_w.jpg|http://ui.cltpstatic.com/places/hotels/8662/866248/images/Extr_1_w.jpg|http://ui.cltpstatic.com/places/hotels/8662/866248/images/Extr2_w.jpg|http://ui.cltpstatic.com/places/hotels/8662/866248/images/Room_Slider8_w.jpg|http://ui.cltpstatic.com/places/hotels/8662/866248/images/Leisure_Vacations_Copperhill_Villa_(1)_w.jpg|http://ui.cltpstatic.com/places/hotels/8662/866248/images/Leisure_Vacations_Copperhill_Villa_(5)_w.jpg|http://ui.cltpstatic.com/places/hotels/8662/866248/images/Leisure_Vacations_Copperhill_Villa_(6)_w.jpg|http://ui.cltpstatic.com/places/hotels/8662/866248/images/Leisure_Vacations_Copperhill_Villa_(8)_w.jpg|http://ui.cltpstatic.com/places/hotels/8662/866248/images/Leisure_Vacations_Copperhill_Villa_(9)_w.jpg|http://ui.cltpstatic.com/places/hotels/8662/866248/images/Leisure_Vacations_Copperhill_Villa_(10)_w.jpg|http://ui.cltpstatic.com/places/hotels/8662/866248/images/Leisure_Vacations_Copperhill_Villa_(11)_w.jpg|http://ui.cltpstatic.com/places/hotels/8662/866248/images/Bath_w.jpg|http://ui.cltpstatic.com/places/hotels/8662/866248/images/Leisure_Vacations_Copperhill_Villa_(7)_w.jpg|http://ui.cltpstatic.com/places/hotels/8662/866248/images/Leisure_Vacations_Copperhill_Villa_(12)_w.jpg|http://ui.cltpstatic.com/places/hotels/8662/866248/images/Restaurant_w.jpg|http://ui.cltpstatic.com/places/hotels/8662/866248/images/Living_Room_w.jpg|http://ui.cltpstatic.com/places/hotels/8662/866248/images/Leisure_Vacations_Copperhill_Villa_(2)_w.jpg,12.462465,75.763827,Leisure Vacations Copper Hill Villa,Hotel,26 X 10 Sq.ft.,4,Television | Wi-Fi Access on Charge | Hair Dryer Bathtub Ceiling Fan Mineral Water Toiletries Flat Screen Television Satellite Television | Tea / Coffee maker | Private Bathroom | Fireplace,Superior Room,Karnataka,,,,2per night incl. tax,1 Adult 1 Kid,Room Service|Internet Access
IG Road,IG Road,Chikmaglur,"Malnad Paradise, Chikmaglur, is a decent accommodation where guests can enjoy homely comforts and a hassle-free stay. With well-furnished rooms, flavoursome meals and essential services, this neat and tidy hotel is a wise choice for fatigued travellers in this lovely coffee land.Location:Malnad Paradise is positioned at IG Road. Baba Budan Giri, Kallathigiri Falls and Sringeri are few other worthwhile tourist spots. The very sight of the water gushing down the Chandra Drona hill at the Kallathigiri Falls is absolutely amazing. This waterfall is surrounded by striking scenery and has the old Veerabhadra temple located in a gap between rocks. Distance from HAL Bangalore International Airport: 286 km (approx.)Distance from Chikmagalur Railway Station: 4 km (approx.) Hotel Features:Total leisure along with delightful dining can be relished at this hotel. Room service, 24-hour front desk, laundry, parking, travel desk, 24-hour security and doctor-on-call are some of the basic facilities for the guests. Guests can savour tempting meals and beverages at the adjoining restaurant and bar.Rooms:Accommodation in the form of deluxe rooms and luxury rooms are available at Malnad Paradise. These rooms are austere and neatly decorated with adequate fixtures. They are pleasant and convenient with amenities such as colour TV.",Food &amp; Beverage:Bar|Restaurant|Travel:Travel Desk|Parking|Free Parking|Outdoor Parking|Transportation Service|Personal Services:24 Hour Front Desk|Laundry|Room Service|Hotel Amenities:24-Hour Security|Basics:Doorman|Housekeeping|Doctor on Call|No Category:Free Newspaper|Front Desk,2 Star hotel,http://ui.cltpstatic.com/places/hotels/3777/377772/images/malnad-paradise_w.jpg|http://ui.cltpstatic.com/places/hotels/3777/377772/images/Malnad_Paradise_1.jpg_w.jpg|http://ui.cltpstatic.com/places/hotels/3777/377772/images/Malnad_Paradise_1.jpg_w.jpg|http://ui.cltpstatic.com/places/hotels/3777/377772/images/Malnad_Paradise_3.jpg_w.jpg|http://ui.cltpstatic.com/places/hotels/3777/377772/images/Malnad_Paradise_2.jpg_w.jpg|http://ui.cltpstatic.com/places/hotels/3777/377772/images/Malnad_Paradise_4.jpg_w.jpg|http://ui.cltpstatic.com/places/hotels/3777/377772/images/Malnad_Paradise_6.jpg_w.jpg|http://ui.cltpstatic.com/places/hotels/3777/377772/images/Malnad_Paradise_5.jpg_w.jpg|http://ui.cltpstatic.com/places/hotels/3777/377772/images/Malnad_Paradise_7.jpg_w.jpg|http://ui.cltpstatic.com/places/hotels/3777/377772/images/malnad-paradis1e_w.jpg,13.3225095,75.7718951,Malnad Paradise,Hotel,15 X 10 Sq.ft.,20,Television | Private Bathroom,Deluxe,Karnataka,9.0,2.0,Location::3.0|Rooms::2.0|Service::2.0|Value::1.5|Cleanliness::2.0|Sleep Quality::2.0,889per night incl. tax,1 Adult 1 Kid,Room Service|Internet Access|Restaurant
Basaveshwara Extension Near Balamuri Temple Kushalnagar,Kushalnagar,Coorg,"Hotel Daffodils, Coong is a beautiful budget hotel located amidst valley in Kushalnagar. The hotel provides warm hospitality and comfortable accommodations for a relaxing holiday. It is a perfect getaway from the hectic schedule of city life and provides all the amenities for both leisure and corporate guests.Location: Hotel Daffodils is located at Basaveshwara extension, near Balamuri temple Kushalnagar. The Namdroling Monastery (Approx. 6km) and the Jamia Masjid (Approx. 8km) are some of the places close to the hotel. Namdroling Monastery belongs to Sangha Community, where Buddhas preachings are preserved intact for worldwide propagation. This monastery was founded by His Holiness, Pema Norbu Rinpoche. Other places that guests can visit are Mallalli Falls, Harangi Dam and the Brahmagiri peak.Distance from Mangalore Airport: Approx. 170kmsDistance from Mysore Junction Railway Station: Approx.89kmsHotel Features: Great location and warm hospitality with contemporary amenities are provided to the guests at the hotel. The basic amenities of the hotel include room service, internet, 24-hour front desk, parking, travel desk, 24-hour security, valet services and doctor-on-call. The hotel provides ayurvedic massages, pick up & drop, tourist sight seeing, tourist information, car rental, driver and guide facilities on request.Rooms: The rooms at the hotel are beautifully constructed and offer majestic view of the valley. The hotel offers standard room and 5 bed room villa for accommodation. The rooms are equipped with all the modern amenities like colour television and wi-fi access.",Basics:Internet|Doorman|Housekeeping|Complimentary Wi-Fi access|Doctor on Call|Travel:Travel Desk|Parking|Free Parking|Transportation Service|Personal Services:24 Hour Front Desk|24 Hour Room Service|Laundry|Room Service|Dry Cleaning|Hotel Amenities:24-Hour Security|No Category:Front Desk|Phone Service|Recreation:Massage Centre,1 Star hotel,http://ui.cltpstatic.com/places/hotels/7076/707628/images/6-21-2013_2-00-15_PM_w.jpg|http://ui.cltpstatic.com/places/hotels/7076/707628/images/6-21-2013_2-03-23_PM_w.jpg|http://ui.cltpstatic.com/places/hotels/7076/707628/images/6-21-2013_2-04-34_PM_w.jpg|http://ui.cltpstatic.com/places/hotels/7076/707628/images/6-21-2013_2-01-44_PM_w.jpg|http://ui.cltpstatic.com/places/hotels/7076/707628/images/6-21-2013_2-02-19_PM_w.jpg|http://ui.cltpstatic.com/places/hotels/7076/707628/images/6-21-2013_2-06-25_PM_w.jpg|http://ui.cltpstatic.com/places/hotels/7076/707628/images/6-21-2013_2-08-19_PM_w.jpg|http://ui.cltpstatic.com/places/hotels/7076/707628/images/6-21-2013_2-08-51_PM_w.jpg|http://ui.cltpstatic.com/places/hotels/7076/707628/images/6-21-2013_2-10-23_PM_w.jpg|http://ui.cltpstatic.com/places/hotels/7076/707628/images/6-21-2013_2-11-39_PM_w.jpg|http://ui.cltpstatic.com/places/hotels/7076/707628/images/6-21-2013_2-07-17_PM_w.jpg|http://ui.cltpstatic.com/places/hotels/7076/707628/images/6-21-2013_2-07-49_PM_w.jpg|http://ui.cltpstatic.com/places/hotels/7076/707628/images/6-21-2013_2-03-57_PM_w.jpg|http://ui.cltpstatic.com/places/hotels/7076/707628/images/6-21-2013_2-05-13_PM_w.jpg,12.465769,75.952244,Dreamland Homestay,Hotel,13.5 X 13.5 Sq.ft.,9,Iron | Television | Express Laundry Service Windows Open | Free Wi-Fi | Luggage Rack,Deluxe Homestay,Karnataka,54.0,4.5,Location::4.0|Rooms::4.5|Service::4.5|Value::4.5|Cleanliness::4.5|Sleep Quality::4.5,1556per night incl. tax,2 Adults 2 Kids,Room Service|Restaurant
"Hoskeri Village, Arecad Post, Via Siddapur,",Siddapur,Coorg,"With its spacious rooms, recreational activities and peaceful ambience, one can get away from the hustle and bustle of city life by staying at Deep Woodz. Situated in the midst of greenery, this hotel invite guests into the world of serenity.",Personal Services:24 Hour Front Desk|Room Service|Travel:Parking|Free Parking|Hotel Amenities:24-Hour Security|Basics:Doorman|Housekeeping|No Category:Front Desk|Recreation:Indoor Games|Bonfire Arrangement|Food &amp; Beverage:Barbeque,3 Star hotel,http://ui.cltpstatic.com/places/hotels/3808/380861/images/141_w.jpg|http://ui.cltpstatic.com/places/hotels/3808/380861/images/291_w.jpg|http://ui.cltpstatic.com/places/hotels/3808/380861/images/erewr_w.jpg|http://ui.cltpstatic.com/places/hotels/3808/380861/images/24_w.jpg|http://ui.cltpstatic.com/places/hotels/3808/380861/images/dxfdf_w.jpg|http://ui.cltpstatic.com/places/hotels/3808/380861/images/ere_w.jpg|http://ui.cltpstatic.com/places/hotels/3808/380861/images/fsd_w.jpg|http://ui.cltpstatic.com/places/hotels/3808/380861/images/iuioiu_w.jpg|http://ui.cltpstatic.com/places/hotels/3808/380861/images/Family_Room_w.jpg|http://ui.cltpstatic.com/places/hotels/3808/380861/images/11_w.jpg|http://ui.cltpstatic.com/places/hotels/3808/380861/images/rre_w.jpg|http://ui.cltpstatic.com/places/hotels/3808/380861/images/rdtrt_w.jpg|http://ui.cltpstatic.com/places/hotels/3808/380861/images/tyty_w.jpg,12.337405,75.83014,Deep Woodz,Hotel,16 X 16 Sq.ft.,7,Television | Hot Water | Satellite Television Windows Open | Wooden Floor | Private Bathroom Balcony / Sit Out Area | Luggage Rack,Double,Karnataka,34.0,4.0,Location::4.5|Rooms::4.5|Service::4.5|Value::4.5|Cleanliness::4.5|Sleep Quality::4.5,1050per night incl. tax,2 Adults 2 Kids,Room Service|Internet Access|Restaurant
"Kunda P.O, Ponnapet Via Gonikoppal, South Kodagu (South Coorg)",Ponnampet,Coorg,"Silver Oaks Home Stay, Coorg is a uniquely beautiful and serene place surrounded by massive hectares of silver oak trees, coffee and spice plantations. Situated on the famous Kunda hill at a height of 4500 ft above sea level, it offers breathtaking views and allows tourists to enjoy trekking in the midst of nature.Location: Silver Oaks is located at Kunda, South Kodagu, which is bordered by the legendary river Cauvery. Coorg hill station is famous for its hospitality and boasts of wonderful places to visit such as Aiyappa Temple (Approx. 4km) and St. Antony's Church (Approx. 6km). Guests can also take a day's leisure trip to Nisargadhama Forest, Nagarhole Park and Dubare Elephant Camp.Distance from Mangalore Airport: Approx. 184kmsDistance from Mangalore Central Railway Station: Approx. 180kmsHotel Features: The hotel surrounded by nature is famous for outdoor activities such as short or long jungle treks, cycling, golfing, archery, fishing and stream walking. Guests who enjoy water can opt for paddle boating, waterfall bathing and jungle stream bathing. Coorg is also famous for its wildlife and bird watching. Some of the indoor games offered include table tennis, chess, state-of-the-art gymnasium and cards. The hotel will arrange for barbecues, camp fires, beach volleyball or shuttle badminton on request. Silver Oaks offers basic amenities for a comfortable stay, including room service, internet, pool, front desk, non-smoking rooms and travel desk. In addition, it offers round the clock security, game room, massage services and doctor-on-call. Business services, conference suite, meeting facilities, equipment such as audiovisual and LCD/Projector are provided to corporate travellers during the stay. The hotels very own multi-cuisine restaurant serves an exotic range of cuisines while the coffee-shop is apt to sooth the wearied senses.Rooms: The accommodation at Silver Oaks Home Stay is luxurious with fireplace inside each cottage. The executive cottages are equipped with basic amenities, which include colour television, internet access, well-stocked mini bar, safe, telephone, DVD player and in-room menu. The cottages portray a lot of Kodava traditions sand promises a relaxed holiday experience to be cherished forever.",Basics:Internet|Non-Smoking Rooms|Doorman|Housekeeping|Wi-Fi on Charge|Doctor on Call|Food &amp; Beverage:Restaurant|Coffee Shop|Recreation:Kids Pool|Gym|Indoor Games|Massage Centre|Water Sports|Travel:Travel Desk|Parking|Transportation Service|Personal Services:24 Hour Front Desk|24 Hour Room Service|Room Service|No Category:Conference facilities|Business services|Conference suite|Front Desk|Phone Service|Business Services:Audio Visual Equipment|LCD / Projector|Meeting Facility|Conference Hall|Hotel Amenities:24-Hour Security|Gift Shop|Basic Room Amenities:Wake-Up Call Service,1 Star hotel,http://ui.cltpstatic.com/places/hotels/3145/314517/images/ghgh_w.jpg|http://ui.cltpstatic.com/places/hotels/3145/314517/images/photo16_w.jpg|http://ui.cltpstatic.com/places/hotels/3145/314517/images/vbvb_w.jpg|http://ui.cltpstatic.com/places/hotels/3145/314517/images/Guestroom2_w.JPG|http://ui.cltpstatic.com/places/hotels/3145/314517/images/Guestroom3_w.JPG|http://ui.cltpstatic.com/places/hotels/3145/314517/images/photo06_w.jpg|http://ui.cltpstatic.com/places/hotels/3145/314517/images/vbvcb_w.jpg|http://ui.cltpstatic.com/places/hotels/3145/314517/images/bvnbvn_w.jpg|http://ui.cltpstatic.com/places/hotels/3145/314517/images/photo09_w.jpg|http://ui.cltpstatic.com/places/hotels/3145/314517/images/Gym_w.JPG|http://ui.cltpstatic.com/places/hotels/3145/314517/images/ccv_w.jpg|http://ui.cltpstatic.com/places/hotels/3145/314517/images/cbgvb_w.jpg,12.147461999999999,75.912145,Silver Oaks Home Stay,Hotel,17 X 10 Sq.ft.,7,Safe| Television| Phone Line| Mini Bar| Iron| Telephone | Internet / Broadband | Hangers Mineral Water In-Room Menu Newspaper | CD / DVD Player | Private Bathroom Writing Desk / Study Table | Luggage Rack,Executive cottage,Karnataka,143.0,4.5,Location::4.0|Rooms::4.0|Service::4.5|Value::4.5|Cleanliness::4.0|Sleep Quality::4.0,332per night incl. tax,1 Adult 2 Kids,Room Service|Internet Access
"Vidya Nagar, Opposite to Golf Ground, Near Mahindra Holidays",Madikeri,Coorg,Guests can experience world class hospitality and services at affordable prices.,Travel:Travel Desk|Parking|Transportation Service|Personal Services:24 Hour Front Desk|24 Hour Room Service|Laundry|Room Service|Hotel Amenities:24-Hour Security|Basics:Doorman|Housekeeping|Doctor on Call|No Category:Front Desk,2 Star hotel,http://ui.cltpstatic.com/places/hotels/7079/707979/images/6-28-2013_6-27-00_PM_w.jpg|http://ui.cltpstatic.com/places/hotels/7079/707979/images/6-28-2013_6-19-03_PM_w.jpg|http://ui.cltpstatic.com/places/hotels/7079/707979/images/6-28-2013_6-26-29_PM_w.jpg|http://ui.cltpstatic.com/places/hotels/7079/707979/images/7-1-2013_10-20-43_AM_w.jpg|http://ui.cltpstatic.com/places/hotels/7079/707979/images/7-1-2013_10-18-03_AM_w.jpg|http://ui.cltpstatic.com/places/hotels/7079/707979/images/7-1-2013_10-18-44_AM_w.jpg|http://ui.cltpstatic.com/places/hotels/7079/707979/images/6-28-2013_6-25-57_PM_w.jpg|http://ui.cltpstatic.com/places/hotels/7079/707979/images/gggggggge_w.jpg|http://ui.cltpstatic.com/places/hotels/7079/707979/images/ggggggggg_w.jpg|http://ui.cltpstatic.com/places/hotels/7079/707979/images/gggggggggg_w.jpg,12.433178999999999,75.71931500000001,Golf View Cottage,Hotel,18 X 10 Sq.ft.,3,Television| Iron | Telephone | Refrigerator | Laundry Bag | Private Bathroom,Standard Room,Karnataka,8.0,3.0,Location::2.5|Rooms::2.0|Service::2.0|Value::2.0|Cleanliness::2.5|Sleep Quality::2.5,500per night incl. tax,1 Adult 2 Kids,Room Service|Internet Access|Free Internet
Dubare Reserve Forest,Kushalnagar,Coorg,"Dubare elephant camp, Coorg, is an exemplary destination for those who want to explore the radiance of this aesthetic place. The camp offers true experience of being with the nature. The elephants taking baths and being cleaned in their natural habitat adds more charm to the place binding their patrons with the serenity of the natural environment. LocationDubare elephant camp, well located near kushalnagar, has maximum linking to different places in the city, some of which include Nisargadhama Forest (25 km), Nagarhole Park (79 km), Omkareshwara Temple (32 km), Dubare Elephant Camp (17 km), Somwarpet (26 km), Bhagamandala (67 km) and Iruppu Falls (80 km).Mangalore Airport- 38 km (approx.)Mysore Railway Station- 88 km (approx.)Periyapatna Bus Stand- 23 km (approx.)FacilitiesThe hotel services include Parking, Indian Restaurant, Bar, Trekking, Nature Walk, Village Walk, Bird Watching and Elephant Ride. There is an ample of space available for parking. The hotel owns an Indian restaurant serving mouth watering and appetizing Indian dishes. The hotel also has an in house well stocked bar serving varieties of liquor to its guests. The visitors can indulge themselves in trekking, nature walk, village walk, bird watching and elephant ride.RoomsThe camp consists of 15 beautiful and well appointed rooms for its visitors. The rooms in the camps are categorized as Cottage and river view Cottage. All the rooms are fully ventilated and kept nicely. The cottages are featured with some of basic services like Hot Water, Direct Dial telephone, Queen Size Bed and Ceiling Fan.",Food &amp; Beverage:Restaurant|Travel:Parking|No Category:Front Desk,2 Star hotel,http://ui.cltpstatic.com/places/hotels/7235/723594/images/dfdfdfdfd_w.jpg|http://ui.cltpstatic.com/places/hotels/7235/723594/images/adfdfaffdfdfd_w.jpg|http://ui.cltpstatic.com/places/hotels/7235/723594/images/guest2_w.jpg|http://ui.cltpstatic.com/places/hotels/7235/723594/images/guest_w.jpg|http://ui.cltpstatic.com/places/hotels/7235/723594/images/image6a_w.jpg|http://ui.cltpstatic.com/places/hotels/7235/723594/images/image8a_w.jpg|http://ui.cltpstatic.com/places/hotels/7235/723594/images/in_w.jpg|http://ui.cltpstatic.com/places/hotels/7235/723594/images/view_from_river_view_w.jpg,12.368513,75.90490600000001,Dubare Elephant Camp,Hotel,23 X 10 Sq.ft.,15,Private Bathroom,Cottage,Karnataka,807.0,4.0,Location::0.0|Rooms::0.0|Service::0.0|Value::0.0|Cleanliness::0.0|Sleep Quality::0.0,1700per night incl. tax,2 Adults 2 Kids,Room Service|Internet Access|Restaurant
"Behind Rotary Hall, Mangala Devi Nagar, Mysore Road, Madikeri (General Thimaiah Road),",Madikeri,Coorg,"Hotel Crystal Court, Coorg is a haven of peace and tranquillity for travellers visiting Madikeri. The hotel provides a peaceful serene ambience surrounded by beautiful hills and dales of Madikeri. The hotel is designed keeping the leisure travellers need in mind.Location: Hotel Crystal Court is located behind Rotary Hall, Mangala Devi Nagar, Mysore road, Madikeri. The tourists can visit Omkareshwara temple Madikeri (Approx. 2km) and Dandina Mariyamma temple (Approx. 2km) from the location. The Omkareshwara temple is dedicated to Lord Shiva has a central dome and four turrets at the corners. This temple reflects the Muhammadan style of architecture. The other interesting places for tourists are Chomamale Hill, Clock Tower and the Pushpagiri Wildlife Sanctuary.Distance from Bangalore International Airport: Approx. 286kmsDistance from Mysore Railway Station: Approx. 117kmsHotel Features: The hotel makes the stay of the guests more convenient by providing them a range of facilities like elevators, parking facilities, room services, security, internet, 24-hour front desk, travel desk and 24-hour security. Social gatherings can be well-arranged with the help of wedding services and banquet services. Corporate guests are ensured with audio visual equipment, LCD/projector as well as business services for a stress-free stay. It also provides intercom, travel assistance and campfire with music facilities on request. Hotel Crystal Court has two restaurants, one for vegetarians and the other for non-vegetarians. The restaurants serve delicious South Indian, North Indian, Tandoor and Chinese dishes along with Coorgi cuisine. Both the restaurants offer good view of the hills and dales of Madikeri. There is a well stocked bar in Hotel Crystal Court, which provides perfect ambience for an evening drink and relaxation. Guest can also enjoy delicious Tandoor and Coorgi dishes along with fine wines.Rooms: The hotel provides a variety of rooms like deluxe A/c, deluxe family non A/c, deluxe family A/c and deluxe non A/c. Inclusive of amenities like air conditioning, colour television, telephone and in-room menu, these rooms are well-appointed, bright and apt for a relax stay in Coorg.",Food &amp; Beverage:Bar|Restaurant|Basics:Internet|Lift|Doorman|Housekeeping|Banquet Facility|Doctor on Call|Travel:Travel Desk|Parking|Indoor Parking|Transportation Service|Personal Services:24 Hour Front Desk|Laundry|Room Service|No Category:Conference facilities|Business services|Front Desk|Phone Service|Wedding Service|Business Services:Audio Visual Equipment|LCD / Projector|Hotel Amenities:24-Hour Security|Catering Service,2 Star hotel,http://ui.cltpstatic.com/places/hotels/1592/159296/images/IMG_4605_1_w.jpg|http://ui.cltpstatic.com/places/hotels/1592/159296/images/IMG_4599_1_w.jpg|http://ui.cltpstatic.com/places/hotels/1592/159296/images/IMG_4596_1_w.jpg|http://ui.cltpstatic.com/places/hotels/1592/159296/images/Result_View_w.jpg|http://ui.cltpstatic.com/places/hotels/1592/159296/images/Entrance_w.jpg|http://ui.cltpstatic.com/places/hotels/1592/159296/images/IMG_4592_1_w.jpg|http://ui.cltpstatic.com/places/hotels/1592/159296/images/IMG_4590_1_w.jpg|http://ui.cltpstatic.com/places/hotels/1592/159296/images/IMG_4556_1_w.jpg|http://ui.cltpstatic.com/places/hotels/1592/159296/images/IMG_4560_1_w.jpg|http://ui.cltpstatic.com/places/hotels/1592/159296/images/IMG_4538_1_w.jpg|http://ui.cltpstatic.com/places/hotels/1592/159296/images/IMG_4548_1_w.jpg|http://ui.cltpstatic.com/places/hotels/1592/159296/images/IMG_4551_1_w.jpg|http://ui.cltpstatic.com/places/hotels/1592/159296/images/Deluxe_Rooms_w.jpg|http://ui.cltpstatic.com/places/hotels/1592/159296/images/Family_Rooms_w.jpg|http://ui.cltpstatic.com/places/hotels/1592/159296/images/Family_Suite_w.jpg|http://ui.cltpstatic.com/places/hotels/1592/159296/images/IMG_4563_1_w.jpg|http://ui.cltpstatic.com/places/hotels/1592/159296/images/IMG_4576_1_w.jpg|http://ui.cltpstatic.com/places/hotels/1592/159296/images/IMG_4606_1_w.jpg|http://ui.cltpstatic.com/places/hotels/1592/159296/images/IMG_4612_1_w.jpg|http://ui.cltpstatic.com/places/hotels/1592/159296/images/IMG_4613_1_w.jpg|http://ui.cltpstatic.com/places/hotels/1592/159296/images/IMG_4616_1_w.jpg|http://ui.cltpstatic.com/places/hotels/1592/159296/images/IMG_4617_1_w.jpg,12.4141965,75.7486939,Hotel Crystal Court,Hotel,17 X 10 Sq.ft.,19,Luggage Rack | Private Bathroom | Television Telephone | Air Conditioning | Satellite Television In-Room Menu | Laundry Bag,Deluxe AC,Karnataka,54.0,3.0,Location::3.5|Rooms::3.0|Service::3.0|Value::3.0|Cleanliness::3.0|Sleep Quality::3.0,1417per night incl. tax,2 Adults 1 Kid,Room Service|Internet Access
"BM Rd, Kushalnagar",Kushalnagar,Coorg,"Vista Rooms at Kushalnagar welcomes one with cosy rooms, essential amenities and a calm ambience for a pleasant stay at Coorg. Additionally, one can savour tempting meals at an in-house restaurant.",Basics:Internet|Air Conditioning|Lift|Pets Allowed|Doorman|Housekeeping|Complimentary Wi-Fi access|Banquet Facility|Doctor on Call|Food &amp; Beverage:Restaurant|Travel:Travel Desk|Parking|Free Parking|Airport Transfer|Railway Station Transfer|Taxi Service|Personal Services:24 Hour Front Desk|24 Hour Room Service|Laundry|Room Service|Hotel Amenities:24-Hour Security|Business Services:Conference Hall,3 Star hotel,http://ui.cltpstatic.com/places/hotels/1323/1323774/images/Hotel_Minister's_Kourt_4_w.jpg|http://ui.cltpstatic.com/places/hotels/1323/1323774/images/Hotel_Minister's_Kourt_5_w.jpg|http://ui.cltpstatic.com/places/hotels/1323/1323774/images/Hotel_Minister's_Kourt_2_w.jpg|http://ui.cltpstatic.com/places/hotels/1323/1323774/images/Hotel_Minister's_Kourt_3_w.jpg,12.447774,75.97090899999999,Vista Rooms at Kushalnagar,Hotel,15 X 20 Sq.ft.,28,Air Conditioning| Television| Iron| Mini Bar| Safe | Telephone | Hair Dryer Newspaper Refrigerator Mirror Hangers Satellite Television | Free Wi-Fi | Private Bathroom,Standard Room,Karnataka,,,,2267per night incl. tax,2 Adults 2 Kids,Internet Access|Restaurant|Swimming Pool
