address,area,city,hotel_description,hotel_facilities,hotel_star_rating,image_urls,latitude,longitude,property_name,property_type,room_area,room_count,room_facilities,room_type,state,tad_review_count,tad_review_rating,tad_stay_review_rating,room_price,occupancy,additional_info
"Vinayaka Complex, P B Road, Devanagere.",Near Bus Terminus,Davanagere,"Srigandha Residency is a Luxury Hotel situated at Pune & Bangalore Road, Davangere, Karnataka. It has air conditioned family rooms with telephone, LCD TV, work area, Attached bath and western toilet with Hot & Cold water available, South Indian & North Indian cuisines are served at the restaurant.Room Service, Laundry service facility, Doctor on call, Spacious car parking with CC camera facility and travel desk are the added features. The Hotel is located just 1 km away from railway station and 2 km away from KSTRC bus stand.",Food &amp; Beverage:Bar|Restaurant|Personal Services:24 Hour Front Desk|24 Hour Room Service|Laundry|Room Service|Basics:Air Conditioning|Non-Smoking Rooms|Express Check-In|Express Check-Out|Doctor on Call|24 Hour Power Supply|Travel:Parking|Free Parking|Transportation Service|Hotel Amenities:24-Hour Security|Catering Service|No Category:Free Newspaper|Front Desk|Basic Room Amenities:Wake-Up Call Service,2 Star hotel,http://ui.cltpstatic.com/places/hotels/7444/744406/images/IMG-20150826-WA0002_w.jpg|http://ui.cltpstatic.com/places/hotels/7444/744406/images/IMG-20150826-WA0003_w.jpg|http://ui.cltpstatic.com/places/hotels/7444/744406/images/IMG-20150826-WA0004_w.jpg|http://ui.cltpstatic.com/places/hotels/7444/744406/images/IMG-20150826-WA0005_w.jpg|http://ui.cltpstatic.com/places/hotels/7444/744406/images/Copy_of_IMG-20151209-WA0013_w.jpg|http://ui.cltpstatic.com/places/hotels/7444/744406/images/Copy_of_IMG-20151209-WA0015_w.jpg|http://ui.cltpstatic.com/places/hotels/7444/744406/images/IMG-20150826-WA0006_w.jpg|http://ui.cltpstatic.com/places/hotels/7444/744406/images/Copy_of_IMG-20151209-WA0008_w.jpg|http://ui.cltpstatic.com/places/hotels/7444/744406/images/Copy_of_IMG-20151209-WA0002_w.jpg|http://ui.cltpstatic.com/places/hotels/7444/744406/images/Copy_of_IMG-20151209-WA0007_w.jpg|http://ui.cltpstatic.com/places/hotels/7444/744406/images/IMG-20150826-WA0007_w.jpg|http://ui.cltpstatic.com/places/hotels/7444/744406/images/IMG-20150826-WA0009_w.jpg|http://ui.cltpstatic.com/places/hotels/7444/744406/images/IMG-20150826-WA0010_w.jpg|http://ui.cltpstatic.com/places/hotels/7444/744406/images/Copy_of_IMG-20151209-WA0009_w.jpg,14.468174,75.91305600000001,Srigandha Residency,Hotel,28 X 28 Sq.ft.,18,Television | Telephone | Newspaper | Mineral Water | Private Bathroom,Standard Room Non AC,Karnataka,70.0,4.5,Location::4.0|Rooms::4.5|Service::4.0|Value::4.5|Cleanliness::4.5|Sleep Quality::4.5,6033per night incl. tax,1 Adult 2 Kids,Room Service|Gym/Spa|Swimming Pool|Restaurant
"Lakya Cross,Opp. OM Poultry Farm10th Km Milestone, Kadur Road",KM Road,Chikmaglur,"A delight for nature lovers, Winter Greens Resort, Chikmaglur, is an eco-friendly destination that offers a peaceful stay. It is a revered venue for corporate events and is home to many outbound training programmes. Set on lush greenery and rare flora, it sets the perfect mood for rejuvenation and unwinding. Location:Winter Greens Resort is located at Kadur road, Lakya Cross. Guests can visit the Kallathigiri Falls, Sringeri and Guru Dattatreya Bababudanswamy Darga that are an intrinsic part of the socio-cultural landscape of the city. Kallahathigiri falls is also known as Kalahasti falls and is at a height of 122 metres. It has a beautiful Shiva temple in a gap between the rocks. Distance from HAL Bangalore International Airport: 285 km (approx.)Distance from Chikmagalur Railway Station: 12 km (approx.)Hotel Features: This beautiful resort offers an array of facilities to its patrons. The resort offers basic amenities such as room service, 24-hour front desk, parking, travel desk and 24-hour security. The in-house restaurant offers mouth-watering delicacies and harnesses energy for cooking purposes, adding a natural flavour to food. Rooms:The hotel has stylish wooden cottages that have a modern look and chic furnishings. All rooms are fully furnished, spacious and well-equipped. They offer a breathtaking view of cascading waterfalls and plantations along with the range of in-room amenities that make the stay wonderful.",Food &amp; Beverage:Restaurant|Travel:Travel Desk|Parking|Free Parking|Personal Services:24 Hour Front Desk|Room Service|Hotel Amenities:24-Hour Security|Basics:Doorman|Housekeeping|No Category:Front Desk,2 Star hotel,http://ui.cltpstatic.com/places/hotels/7176/717602/images/04-Feb-14_1-41-04_PM_w.jpg|http://ui.cltpstatic.com/places/hotels/7176/717602/images/aswda_w.jpg|http://ui.cltpstatic.com/places/hotels/7176/717602/images/dsfd_w.jpg|http://ui.cltpstatic.com/places/hotels/7176/717602/images/gffd_w.jpg|http://ui.cltpstatic.com/places/hotels/7176/717602/images/Untitled_w.jpg|http://ui.cltpstatic.com/places/hotels/7176/717602/images/dfgfd_w.jpg|http://ui.cltpstatic.com/places/hotels/7176/717602/images/ghgh_w.jpg|http://ui.cltpstatic.com/places/hotels/7176/717602/images/mghhg_w.jpg|http://ui.cltpstatic.com/places/hotels/7176/717602/images/resttttttt_w.jpg|http://ui.cltpstatic.com/places/hotels/7176/717602/images/tgdfg_w.jpg,13.349319400000002,75.84675820000001,Winter Greens Resort,Resort,18 X 18 Sq.ft.,13,Private Bathroom | Luggage Rack | Bedside Lamp,Wooden Cottage,Karnataka,28.0,2.5,Location::3.0|Rooms::2.5|Service::3.0|Value::2.5|Cleanliness::2.5|Sleep Quality::3.0,436per night incl. tax,1 Adult 1 Kid,Room Service|Gym/Spa|Restaurant|Free Internet
"Biligeri Village, Hakathur Post, Sampaje Hobli, Madikeri Thaluk, Kodagu Dist",Madikeri,Coorg,"Set amidst a bunch of areca palm and cardamom trees looking at a water stream on the foothills of Coorg, having infrastructure which is aesthetically designed complying with needs of the nature.",Basics:Internet|Express Check-In|Express Check-Out|Housekeeping|Doctor on Call|24 Hour Power Supply|Food &amp; Beverage:Restaurant|Coffee Shop|Personal Services:24 Hour Front Desk|Laundry|Room Service|Travel:Parking|Outdoor Parking|Hotel Amenities:24-Hour Security|Catering Service|Courtyard|Business Services:Conference Hall|Recreation:Outdoor Swimming Pool,3 Star hotel,http://ui.cltpstatic.com/places/hotels/1328/1328428/images/Copy_of_IMG-20150915-WA002_w.jpg|http://ui.cltpstatic.com/places/hotels/1328/1328428/images/Copy_of_IMG-20151005-WA004_w.jpg|http://ui.cltpstatic.com/places/hotels/1328/1328428/images/WLD_0039_w.jpg|http://ui.cltpstatic.com/places/hotels/1328/1328428/images/WLD_0050-web_w.jpg|http://ui.cltpstatic.com/places/hotels/1328/1328428/images/WLD_0087_w.jpg|http://ui.cltpstatic.com/places/hotels/1328/1328428/images/WLD_0091_w.jpg|http://ui.cltpstatic.com/places/hotels/1328/1328428/images/WLD_0072_w.jpg|http://ui.cltpstatic.com/places/hotels/1328/1328428/images/WLD_0098_w.jpg|http://ui.cltpstatic.com/places/hotels/1328/1328428/images/Copy_of_F1_w.jpg|http://ui.cltpstatic.com/places/hotels/1328/1328428/images/Copy_of_IMG-20150915-WA001_w.jpg|http://ui.cltpstatic.com/places/hotels/1328/1328428/images/Copy_of_IMG-20151005-WA000_w.jpg|http://ui.cltpstatic.com/places/hotels/1328/1328428/images/Copy_of_IMG-20151005-WA001_w.jpg|http://ui.cltpstatic.com/places/hotels/1328/1328428/images/Copy_of_IMG-20151005-WA002_w.jpg|http://ui.cltpstatic.com/places/hotels/1328/1328428/images/Copy_of_IMG-20151005-WA003_w.jpg|http://ui.cltpstatic.com/places/hotels/1328/1328428/images/WLD_0103_w.jpg|http://ui.cltpstatic.com/places/hotels/1328/1328428/images/WLD_0106_w.jpg|http://ui.cltpstatic.com/places/hotels/1328/1328428/images/WLD_0112_w.jpg|http://ui.cltpstatic.com/places/hotels/1328/1328428/images/WLD_0128_w.jpg|http://ui.cltpstatic.com/places/hotels/1328/1328428/images/WLD_0168_w.jpg|http://ui.cltpstatic.com/places/hotels/1328/1328428/images/WLD_0164_w.jpg|http://ui.cltpstatic.com/places/hotels/1328/1328428/images/Coorg-2_w.jpg|http://ui.cltpstatic.com/places/hotels/1328/1328428/images/Coorg-3_w.jpg|http://ui.cltpstatic.com/places/hotels/1328/1328428/images/Copy_of_IMG-20150915-WA003_w.jpg|http://ui.cltpstatic.com/places/hotels/1328/1328428/images/Copy_of_IMG-20151005-WA005_w.jpg|http://ui.cltpstatic.com/places/hotels/1328/1328428/images/Coorg-1_w.jpg|http://ui.cltpstatic.com/places/hotels/1328/1328428/images/WLD_0010_w.jpg|http://ui.cltpstatic.com/places/hotels/1328/1328428/images/WLD_0024_w.jpg|http://ui.cltpstatic.com/places/hotels/1328/1328428/images/WLD_0063_w.jpg|http://ui.cltpstatic.com/places/hotels/1328/1328428/images/WLD_0067_w.jpg|http://ui.cltpstatic.com/places/hotels/1328/1328428/images/WLD_0176_w.jpg,12.369413,75.755802,La Flora Prakruth Resort,Hotel,28 X 10 Sq.ft.,21,Air Conditioning| Telephone| Spare Mattress | Linen Available | Toiletries Mirror | In-Room Menu | Private Bathroom,Villa,Karnataka,61.0,4.0,Location::3.5|Rooms::3.5|Service::3.5|Value::3.0|Cleanliness::4.0|Sleep Quality::3.5,750per night incl. tax,2 Adults 2 Kids,Room Service|Restaurant|Free Internet
"Niduvale, Mudigere",Mudigere,Chikmaglur,"Villa Urvinkhan, Chikamagalur is a delightful hotel amidst splendid mountains and flourishing greenery. It is an ideal destination for families and individuals who want to stay in peace and explore nature in its true sense. It offers well-furnished villas appointed with contemporary amenities for a satisfying stay. This smart property, with its mesmerizing ambience and refreshing recreational activities assures an utmost relaxation in the lap of nature.LocationVilla Urvinkhan is well-placed in the tropical rain forest of Western Ghats at Niduvale. There are some visiting places in its close proximity like Bandaje-Arbi Falls (25km), Amba Teertha (37.5km), Sri Venkataramana Temple (36.5km), Hanumana Gundi Waterfalls (73.5km), Dharmasthala Welcome Gate (60km), Manjusha Museum (60.5km) and Manjarabad Fort (64.5km).Mangalore International Airport - 117km (Approx.)Donigal Railway Station - 68km (Approx.)Gabgal Hemmakki Bus Stop - 5.8km (Approx.)FacilitiesVilla Urvinkhan offers remarkable facilities like restaurant, swimming pool, free parking, sightseeing tours, trekking, fishing and various recreational activities. The restaurant offers a wide variety of South Indian and Continental breakfast and authentic Malnad cuisine for lunch and dinner in its perfect setting. A colossal swimming pool allows guests to get refreshed and revived. Free parking facility is available for the clients to conveniently park their vehicles. High speed internet facility keeps the guests connected all the time. Recreational activities offered by the hotel are trekking, fishing in the estate lake, night walk in jungle, tour of a coffee plantation, cycling, bird watching and special tours to historical places. RoomsVilla Urvinkhan offers a relaxed and pleasant stay in its 4 well-furnished Villas. The villas are designed with comfy wooden fixtures, wooden floor and thatched roof. They are appointed with king sized colonial four post bed and television. There is a fire place in each villa where guests can relax and spend some leisure time. An attached bathroom is available in all the villas with an open bath.",Basics:Internet|Food &amp; Beverage:Restaurant|Recreation:Kids Pool|Travel:Travel Desk|Parking|Free Parking|No Category:Front Desk|Basic Room Amenities:Wake-Up Call Service,4 Star hotel,http://ui.cltpstatic.com/places/hotels/7078/707855/images/6-26-2013_4-26-32_PM_w.jpg|http://ui.cltpstatic.com/places/hotels/7078/707855/images/filename-img-1101-jpg_w.jpg|http://ui.cltpstatic.com/places/hotels/7078/707855/images/Untitled-1_w.jpg|http://ui.cltpstatic.com/places/hotels/7078/707855/images/6-26-2013_4-25-20_PM_w.jpg|http://ui.cltpstatic.com/places/hotels/7078/707855/images/6-26-2013_4-25-55_PM_w.jpg|http://ui.cltpstatic.com/places/hotels/7078/707855/images/6-26-2013_4-27-18_PM_w.jpg|http://ui.cltpstatic.com/places/hotels/7078/707855/images/6-26-2013_4-27-49_PM_w.jpg|http://ui.cltpstatic.com/places/hotels/7078/707855/images/6-26-2013_4-28-29_PM_w.jpg|http://ui.cltpstatic.com/places/hotels/7078/707855/images/6-26-2013_4-29-06_PM_w.jpg|http://ui.cltpstatic.com/places/hotels/7078/707855/images/6-26-2013_4-29-54_PM_w.jpg|http://ui.cltpstatic.com/places/hotels/7078/707855/images/6-26-2013_4-32-34_PM_w.jpg|http://ui.cltpstatic.com/places/hotels/7078/707855/images/6-26-2013_4-33-15_PM_w.jpg|http://ui.cltpstatic.com/places/hotels/7078/707855/images/6-26-2013_4-34-30_PM_w.jpg|http://ui.cltpstatic.com/places/hotels/7078/707855/images/6-26-2013_4-38-15_PM_w.jpg|http://ui.cltpstatic.com/places/hotels/7078/707855/images/6-26-2013_4-40-23_PM_w.jpg|http://ui.cltpstatic.com/places/hotels/7078/707855/images/6-26-2013_4-40-53_PM_w.jpg|http://ui.cltpstatic.com/places/hotels/7078/707855/images/villa-urvinkhan_(2)_w.jpg|http://ui.cltpstatic.com/places/hotels/7078/707855/images/6-26-2013_4-23-55_PM_w.jpg,13.186202999999999,75.48709699999999,Villa Urvinkhan,Resort,16 X 16 Sq.ft.,4,Television | Private Bathroom | Wooden Floor,Villas,Karnataka,126.0,5.0,Location::5.0|Rooms::5.0|Service::4.5|Value::4.5|Cleanliness::5.0|Sleep Quality::5.0,400per night incl. tax,1 Adult 1 Kid,Room Service|Swimming Pool|Restaurant
"Block No.16 G.T.Road, (Mysore-Madikeri Road)",Madikeri,Coorg,"Located in the midst of cardamom and coffee plantations of Coorg, Cavery Residency offers a heart-warming hospitality that feels like home. Further accentuating the guests' stay are the comfortable rooms and basic amenities.",Business Services:Business Center|Basics:Internet|Doorman|Express Check-In|Express Check-Out|Housekeeping|Doctor on Call|24 Hour Power Supply|Food &amp; Beverage:Restaurant|Travel:Travel Desk|Parking|Free Parking|Valet Parking|Personal Services:24 Hour Front Desk|24 Hour Room Service|Laundry|Room Service|Dry Cleaning|Hotel Amenities:24-Hour Security|No Category:Front Desk|Phone Service|Basic Room Amenities:Wake-Up Call Service,2 Star hotel,http://ui.cltpstatic.com/places/hotels/3154/315478/images/IMG_3867_w.jpg|http://ui.cltpstatic.com/places/hotels/3154/315478/images/IMG_3865_w.jpg|http://ui.cltpstatic.com/places/hotels/3154/315478/images/IMG_3825_w.jpg|http://ui.cltpstatic.com/places/hotels/3154/315478/images/IMG_3828_w.jpg|http://ui.cltpstatic.com/places/hotels/3154/315478/images/IMG_3854_w.jpg|http://ui.cltpstatic.com/places/hotels/3154/315478/images/IMG_3839_w.jpg|http://ui.cltpstatic.com/places/hotels/3154/315478/images/IMG_3837_w.jpg|http://ui.cltpstatic.com/places/hotels/3154/315478/images/IMG_3863_w.jpg|http://ui.cltpstatic.com/places/hotels/3154/315478/images/IMG_3849_w.jpg|http://ui.cltpstatic.com/places/hotels/3154/315478/images/IMG_3816_w.jpg|http://ui.cltpstatic.com/places/hotels/3154/315478/images/IMG_3821_w.jpg|http://ui.cltpstatic.com/places/hotels/3154/315478/images/IMG_3852_w.jpg|http://ui.cltpstatic.com/places/hotels/3154/315478/images/IMG_3858_w.jpg,12.415111999999999,75.745257,Cavery Residency,Resort,14 X 14 Sq.ft.,13,Television | Telephone | Newspaper Intercom Flat Screen Television Mirror Hangers | In-Room Menu | Private Bathroom | Balcony / Sit Out Area,Suite,Karnataka,56.0,3.5,Location::4.0|Rooms::3.5|Service::3.5|Value::3.5|Cleanliness::3.5|Sleep Quality::4.0,936per night incl. tax,2 Adults 2 Kids,Room Service|Internet Access|Gym/Spa|Swimming Pool
"K.M. Road, Opp to KSRTC Bus Depot",KM Road,Chikmaglur,"The Planters Court, Chikmaglur, is the oldest business cum leisure hotel that offers superior options and comfortable living. The modern construction and contemporary interiors makes the hotel one of the most favourite accommodation in the area. The budget, utilitarian and functional hotel offers the best in services and the finest in South Indian cuisine.Location: The Planters Court is located at K.M. road, opp. to KSRTC bus depot. It is in proximity to the bustling little coffee town and close enough to the main street. The places for guests to visit are Mullayanagiri, Baba Budan Giri and Manikyadhara Falls. The falls are near the famous pilgrim centre Baba Budan Giri Battatreya Peetha where the water falls like small droplets of pears on visitors standing nearby. Chickmagalur is located at the foothills of Mullayanagiri range and known for its coffee and tea estates.Distance from HAL Bangalore International Airport: 264 km (approx.)Distance from Chikmagalur Railway Station: 3 km (approx.)Hotel Features: The Planters Court is a beautiful place with a calm, restful ambience and plenty of facilities to keep a modern day visitor happy and satisfied. The basic amenities offered by the hotel include room service, front desk, travel desk, doctor-on-call and 24-hour security. Additionally, it offers wheel chair access, plenty of parking space, catering services and banquet facilities for small gatherings with catering services. Business guests can avail of the business centre. The restaurant at The Planters Court offers delicious South Indian vegetarian cuisine with mouth watering choices.Rooms: The hotel offers a wide range of accommodation to suit every kind of traveller. All rooms are tastefully furnished and offer luxury and comfort in a peaceful and calm ambience. Some of the room options offered are deluxe air conditioned and non-air conditioned rooms as well as executive deluxe non air conditioned rooms. The basic room amenities include colour television, telephone and a writing desk. All rooms have windows that open out letting in the sweet and refreshing smell of the coffee plantations nearby.",Food &amp; Beverage:Bar|Restaurant|Business Services:Business Center|Meeting Facility|Conference Hall|Travel:Travel Desk|Parking|Bus Parking|Personal Services:24 Hour Front Desk|24 Hour Room Service|Laundry|Room Service|Dry Cleaning|No Category:Conference facilities|Conference suite|Front Desk|Phone Service|Basics:Facility for Disabled Guest|Doorman|Express Check-Out|Housekeeping|Banquet Facility|Doctor on Call|Hotel Amenities:24-Hour Security|Catering Service|Gift Shop|Basic Room Amenities:Wake-Up Call Service,2 Star hotel,http://ui.cltpstatic.com/places/hotels/3553/355321/images/IMG_0133_w.jpg|http://ui.cltpstatic.com/places/hotels/3553/355321/images/201109291235257000_common_facade_1_w.jpg|http://ui.cltpstatic.com/places/hotels/3553/355321/images/IMG_0140_w.jpg|http://ui.cltpstatic.com/places/hotels/3553/355321/images/IMG_0262_w.jpg|http://ui.cltpstatic.com/places/hotels/3553/355321/images/IMG_0263_w.jpg|http://ui.cltpstatic.com/places/hotels/3553/355321/images/IMG_0243_w.jpg|http://ui.cltpstatic.com/places/hotels/3553/355321/images/201109291235257000_common_corridor_1_w.jpg|http://ui.cltpstatic.com/places/hotels/3553/355321/images/IMG_0228_w.jpg|http://ui.cltpstatic.com/places/hotels/3553/355321/images/IMG_0174_w.jpg|http://ui.cltpstatic.com/places/hotels/3553/355321/images/IMG_0176_w.jpg|http://ui.cltpstatic.com/places/hotels/3553/355321/images/IMG_0214_w.jpg|http://ui.cltpstatic.com/places/hotels/3553/355321/images/IMG_0155_w.jpg|http://ui.cltpstatic.com/places/hotels/3553/355321/images/IMG_0162_w.jpg|http://ui.cltpstatic.com/places/hotels/3553/355321/images/IMG_0201_w.jpg|http://ui.cltpstatic.com/places/hotels/3553/355321/images/IMG_0204_w.jpg|http://ui.cltpstatic.com/places/hotels/3553/355321/images/IMG_0188_w.jpg|http://ui.cltpstatic.com/places/hotels/3553/355321/images/IMG_0193_w.jpg|http://ui.cltpstatic.com/places/hotels/3553/355321/images/201109291235257000_room_executive_deluxe_non_ac_1_w.jpg|http://ui.cltpstatic.com/places/hotels/3553/355321/images/201109291235257000_room_planter_suite_ac_1_w.jpg|http://ui.cltpstatic.com/places/hotels/3553/355321/images/201109291235257000_room_planter_suite_ac_2_w.jpg|http://ui.cltpstatic.com/places/hotels/3553/355321/images/201109291235257000_room_standard_ac_1_w.jpg|http://ui.cltpstatic.com/places/hotels/3553/355321/images/201109291235257000_room_standard_ac_2_w.jpg|http://ui.cltpstatic.com/places/hotels/3553/355321/images/IMG_0235_w.jpg|http://ui.cltpstatic.com/places/hotels/3553/355321/images/IMG_0223_w.jpg|http://ui.cltpstatic.com/places/hotels/3553/355321/images/IMG_0164_w.jpg|http://ui.cltpstatic.com/places/hotels/3553/355321/images/IMG_0209_w.jpg|http://ui.cltpstatic.com/places/hotels/3553/355321/images/IMG_0199_w.jpg|http://ui.cltpstatic.com/places/hotels/3553/355321/images/201109291235257000_room_executive_deluxe_non_ac_bathroom_2_w.jpg|http://ui.cltpstatic.com/places/hotels/3553/355321/images/201109291235257000_room_planter_suite_ac_bathroom_1_w.jpg|http://ui.cltpstatic.com/places/hotels/3553/355321/images/201109291235257000_room_standard_ac_bathroom_2_w.jpg|http://ui.cltpstatic.com/places/hotels/3553/355321/images/IMG_0251_w.jpg|http://ui.cltpstatic.com/places/hotels/3553/355321/images/IMG_0253_w.jpg|http://ui.cltpstatic.com/places/hotels/3553/355321/images/IMG_0254_w.jpg|http://ui.cltpstatic.com/places/hotels/3553/355321/images/201109291235257000_common_restaurant_1_w.jpg|http://ui.cltpstatic.com/places/hotels/3553/355321/images/201109291235257000_common_restaurant_2_w.jpg|http://ui.cltpstatic.com/places/hotels/3553/355321/images/IMG_0232_w.jpg|http://ui.cltpstatic.com/places/hotels/3553/355321/images/201109291235257000_common_reception_1_w.jpg,13.308646,75.769423,The Planters Court,Resort,20 X 20 Sq.ft.,44,Air Conditioning| Television | Telephone | Newspaper Intercom Express Laundry Service Flat Screen Television Hangers Laundry Bag | Windows Open | Private Bathroom Luggage Rack | Writing Desk / Study Table,Deluxe A/c,Karnataka,124.0,3.0,Location::3.5|Rooms::3.0|Service::3.0|Value::3.0|Cleanliness::2.5|Sleep Quality::3.0,18606per night incl. tax,2 Adults 2 Kids,Room Service|Internet Access|Gym/Spa|Swimming Pool|Restaurant|Free Internet
"Mysore Road, Opposite Lions Club, Madikeri Mysore Road",Madikeri,Coorg,OYO Homes Opposite Loins Club Madikeri Coorg greets guests with warm hospitality. Guests can leave behind the fast pace of city life and be close to nature by staying in the spacious rooms of this lovely hotel.,Basics:Internet|Air Conditioning|Doorman|Housekeeping|Complimentary Wi-Fi access|24 Hour Power Supply|Personal Services:24 Hour Front Desk|Room Service|Travel:Parking|Hotel Amenities:24-Hour Security,3 Star hotel,http://ui.cltpstatic.com/places/hotels/1350/1350160/images/1350160-1_w.jpg|http://ui.cltpstatic.com/places/hotels/1350/1350160/images/1350160-2_w.jpg|http://ui.cltpstatic.com/places/hotels/1350/1350160/images/1350160-3_w.jpg|http://ui.cltpstatic.com/places/hotels/1350/1350160/images/1350160-4_w.jpg|http://ui.cltpstatic.com/places/hotels/1350/1350160/images/1350160-5_w.jpg|http://ui.cltpstatic.com/places/hotels/1350/1350160/images/1350160-6_w.jpg|http://ui.cltpstatic.com/places/hotels/1350/1350160/images/1350160-10_w.jpg,12.417941599999999,75.74646329999999,OYO Homes Opposite Loins Club Madikeri Coorg,Resort,12 X 10 Sq.ft.,15,Television| Iron| Room Heater | Wardrobe | Marble Floor Wooden Floor | Wake-Up Call Service,Standard Room AC,Karnataka,,,,156per night incl. tax,1 Adult 1 Kid,Room Service|Restaurant
"Magatagiri Bus Shelter, Nagarhole- Kanoor Road, Mathoor Village, Ponnampet, Via Gonikoppa, South Coorg",Kutta,Coorg,"Green Valley - the Best Resort in Coorg is located on Kutta-Nagarahole Road-which is near RAJIV GANDHI National Park, Via Ponnampet, South Coorg in a serene, unpolluted atmosphere in lush green plantation overlooking a Valley. Its an ideal location for family vacations, holiday stay in Coorg. To relax, unwind and enjoy nature in its abundance. You wake up to a blanket of mist, chirping birds and the morning sunshine shimmering through the Flora & Fauna.This is a truly a tucked away private place for you to be on your own. You can spend the whole day lazing in the portico or in our hammocks with your favorite music or book. We also have World Space with over 40 favorite music channels for you to catch up with. The food is delicious and hygienic and prepared with care by our staff in our well maintained and clean kitchen.Out kitchen staff shall prepare the food as per your menu and serve it piping hot always.Each evening is an experience around the campfire and barbecuing your favorite delights and tucking away yourselves in our cozy beds. The rooms are with attached baths and are maintained in spic n span condition all the time. If you are adventurous, you can spend the night in our cozy tents and during monsoons you can venture into some river rafting close-by under professional gudiance.You can visit the famous Irupu Falls and sit right beneath the falls with the water pounding you from top and giving you a natural massage and go ahead to the Nagarahole Reserve Forest for a safari in the Jungles of Nagarahole, known for its famous Tigers, Bisons and Deers. Green Valley Resort also provides holiday reservations, best holiday packages, in Coorg.",Travel:Parking|Free Parking,1 Star hotel,http://ui.cltpstatic.com/places/hotels/7202/720280/images/24-Mar-14_12-42-44_PM_w.jpg|http://ui.cltpstatic.com/places/hotels/7202/720280/images/24-Mar-14_12-48-40_PM_w.jpg|http://ui.cltpstatic.com/places/hotels/7202/720280/images/guest_w.jpg|http://ui.cltpstatic.com/places/hotels/7202/720280/images/in_de_w.jpg|http://ui.cltpstatic.com/places/hotels/7202/720280/images/tent_toom_w.jpg|http://ui.cltpstatic.com/places/hotels/7202/720280/images/tent_w.jpg,12.132665,75.961776,Green Valley,Hotel,24 X 24 Sq.ft.,8,Private Bathroom,Four Beded Room,Karnataka,15.0,4.0,Location::4.0|Rooms::4.5|Service::4.0|Value::4.0|Cleanliness::4.5|Sleep Quality::4.0,1112per night incl. tax,2 Adults 1 Kid,Room Service|Gym/Spa|Swimming Pool|Restaurant|Free Internet
